Headline,Link,Headline Score
Can Livent Corporation (LTHM) Add Value To Your Portfolio?,https://fostersleader.com/2022/05/14/can-livent-corporation-lthm-add-value-to-your-portfolio/,"{'neg': 0.0, 'neu': 0.769, 'pos': 0.231, 'compound': 0.34}"
Livent Corp (LTHM) Stock Falls -6.60% This Week; Should You Buy?,https://www.investorsobserver.com/news/stock-update/livent-corp-lthm-stock-falls-6-60-this-week-should-you-buy,"{'neg': 0.0, 'neu': 1.0, 'pos': 0.0, 'compound': 0.0}"
Research Analysts Issue Forecasts for Livent Co.'s Q2 2022 Earnings (NYSE:LTHM),https://www.defenseworld.net/2022/05/13/research-analysts-issue-forecasts-for-livent-co-s-q2-2022-earnings-nyselthm.html,"{'neg': 0.0, 'neu': 1.0, 'pos': 0.0, 'compound': 0.0}"
B. Riley Brokers Raise Earnings Estimates for Livent Co. (NYSE:LTHM),https://www.etfdailynews.com/2022/05/13/b-riley-brokers-raise-earnings-estimates-for-livent-co-nyselthm/,"{'neg': 0.0, 'neu': 1.0, 'pos': 0.0, 'compound': 0.0}"
Roll up the Sleeves! When the bell rang at previous close Livent Corporation (LTHM) was up 0.61%,https://investchronicle.com/2022/05/12/roll-up-the-sleeves-when-the-bell-rang-at-previous-close-livent-corporation-lthm-was-up-0-61/,"{'neg': 0.0, 'neu': 1.0, 'pos': 0.0, 'compound': 0.0}"
News Flash: Analysts Just Made A Huge Upgrade To Their Livent Corporation (NYSE:LTHM) Forecasts,https://finance.yahoo.com/news/news-flash-analysts-just-made-101232725.html,"{'neg': 0.0, 'neu': 0.839, 'pos': 0.161, 'compound': 0.3182}"
$194.77 Million in Sales Expected for Livent Co. (NYSE:LTHM) This Quarter,https://www.etfdailynews.com/2022/05/12/194-77-million-in-sales-expected-for-livent-co-nyselthm-this-quarter/,"{'neg': 0.0, 'neu': 1.0, 'pos': 0.0, 'compound': 0.0}"
Zacks: Brokerages Expect Livent Co. (NYSE:LTHM) Will Announce Quarterly Sales of $194.77 Million,https://www.defenseworld.net/2022/05/12/zacks-brokerages-expect-livent-co-nyselthm-will-announce-quarterly-sales-of-194-77-million.html,"{'neg': 0.0, 'neu': 1.0, 'pos': 0.0, 'compound': 0.0}"
Should Specialty Chemicals Stock Livent Corp (LTHM) Be in Your Portfolio Wednesday?,https://www.investorsobserver.com/news/stock-update/should-specialty-chemicals-stock-livent-corp-lthm-be-in-your-portfolio-wednesday-2,"{'neg': 0.0, 'neu': 1.0, 'pos': 0.0, 'compound': 0.0}"
Livent Corporation (LTHM) Upgraded Issued by Wall Street Gurus,https://newsheater.com/2022/05/11/livent-corporation-lthm-upgraded-issued-by-wall-street-gurus/,"{'neg': 0.0, 'neu': 1.0, 'pos': 0.0, 'compound': 0.0}"
